{
  "schema_version": "prc.control-classification-review/v0.1",
  "packet_id": "docs-checklists-06-data-privacy-performance-md-part-001",
  "methodology_sha256": "a98007a2924a71405acd5d084577c9675a293d8eec43b9e06a37b743e3bec433",
  "registry_version": "0.1.0",
  "registry_sha256": "7448c14fd9e3c3ce7a1fa9ea28a2ce98f8d0a1a3fe55239ba1d4715c4870bc9b",
  "source_path": "docs/checklists/06-data-privacy-performance.md",
  "controls": [
    {
      "control_id": "PRC-23-001",
      "revision": 1,
      "semantic_sha256": "85e4d065b6efec29a722c5ba981e104322165c45235f6d13ae96602540868d66",
      "classification": "deterministic",
      "route": "deterministic_composite",
      "reason": "Given an authoritative inventory, ownership and classification are exact required fields whose presence and allowed values can be checked for every listed data set.",
      "deterministic_clauses": [
        {
          "statement": "The authoritative data-set inventory enumerates every in-scope data set by stable identifier.",
          "checker_family": "inventory_fact",
          "evidence_authority": "structured_record"
        },
        {
          "statement": "Every inventoried data set has a nonempty owner identifier and a classification value allowed by the versioned classification policy.",
          "checker_family": "structured_record",
          "evidence_authority": "structured_record"
        }
      ],
      "nondeterministic_reason_codes": [],
      "review_status": "primary_agent_reviewed"
    },
    {
      "control_id": "PRC-23-002",
      "revision": 1,
      "semantic_sha256": "11f7db03aad016b43d6633c323a19bf7e116d1ac0d904c8e61222c16e3b2e626",
      "classification": "nondeterministic",
      "route": "mixed",
      "reason": "Declared required constraints can be compared with schema enforcement, but deciding which constraints the domain requires is a model-design judgment that repository inspection cannot make.",
      "deterministic_clauses": [
        {
          "statement": "Every constraint declared in the approved data-model contract is present in the authoritative schema or an identified deterministic enforcement layer.",
          "checker_family": "source_ast",
          "evidence_authority": "repository"
        }
      ],
      "nondeterministic_reason_codes": [
        "contextual_judgment",
        "undefined_scope",
        "mixed_with_nondeterministic_child"
      ],
      "review_status": "primary_agent_reviewed"
    },
    {
      "control_id": "PRC-23-003",
      "revision": 1,
      "semantic_sha256": "e7e3b80f8810440f8b9b40d51c9e4db1998b8baadd56e3a03ef6852f6bfe90ae",
      "classification": "nondeterministic",
      "route": "mixed",
      "reason": "Schema and boundary tests can reject absence for fields already declared required, but determining the complete required-field set and proving no ingestion path silently drops values remain contextual and unbounded.",
      "deterministic_clauses": [
        {
          "statement": "For each field marked required in the approved model, the schema and bounded boundary tests reject missing or null values.",
          "checker_family": "execution_evidence",
          "evidence_authority": "executed"
        }
      ],
      "nondeterministic_reason_codes": [
        "contextual_judgment",
        "unbounded_scope",
        "mixed_with_nondeterministic_child"
      ],
      "review_status": "primary_agent_reviewed"
    },
    {
      "control_id": "PRC-23-004",
      "revision": 1,
      "semantic_sha256": "073d0d8f1ca03028f117c10bcada35a9b15f316e536855aee59d862defc2edd7",
      "classification": "nondeterministic",
      "route": "contextual_judgment",
      "reason": "The correct consistency boundary depends on domain invariants, race costs, and deployment topology; uniqueness declarations alone cannot decide whether enforcement is placed correctly.",
      "deterministic_clauses": [],
      "nondeterministic_reason_codes": [
        "contextual_judgment",
        "undefined_scope"
      ],
      "review_status": "primary_agent_reviewed"
    },
    {
      "control_id": "PRC-23-005",
      "revision": 1,
      "semantic_sha256": "a90f6cc9498b6604cfbc95e6f74aab63d28e772bbfb6ceb3f0f914a9f1b14018",
      "classification": "deterministic",
      "route": "deterministic_composite",
      "reason": "With a complete relationship inventory and an approved check cadence, each relationship can be matched exactly to a database constraint or authenticated continuous-check evidence.",
      "deterministic_clauses": [
        {
          "statement": "The authoritative relationship inventory enumerates every in-scope referential relationship and its allowed integrity mechanism.",
          "checker_family": "structured_record",
          "evidence_authority": "structured_record"
        },
        {
          "statement": "Each inventoried relationship has either a matching enforced constraint or a current integrity-check job meeting the approved cadence.",
          "checker_family": "environment_evidence",
          "evidence_authority": "environment"
        }
      ],
      "nondeterministic_reason_codes": [],
      "review_status": "primary_agent_reviewed"
    },
    {
      "control_id": "PRC-23-006",
      "revision": 1,
      "semantic_sha256": "d50c53a60dc434ce1a35c9bd0f48abcaa8eba38c95dd022d0738594f9a7f5e71",
      "classification": "nondeterministic",
      "route": "mixed",
      "reason": "Transaction boundaries can be extracted and compared with declared atomic operations, but deciding every operation that requires atomicity depends on business invariants and failure semantics.",
      "deterministic_clauses": [
        {
          "statement": "Every operation declared atomic in the approved invariant registry is enclosed by a matching transaction or equivalent atomic primitive.",
          "checker_family": "source_ast",
          "evidence_authority": "repository"
        }
      ],
      "nondeterministic_reason_codes": [
        "contextual_judgment",
        "undefined_scope",
        "mixed_with_nondeterministic_child"
      ],
      "review_status": "primary_agent_reviewed"
    },
    {
      "control_id": "PRC-23-007",
      "revision": 1,
      "semantic_sha256": "9a1e6f49556fe1cc710a7b37094cf467534ae6fbbd8bbd8488e61d0dda362355",
      "classification": "nondeterministic",
      "route": "contextual_judgment",
      "reason": "A document can be found mechanically, but whether it covers the relevant locking and concurrency strategies requires understanding the system's real shared-state and race surfaces.",
      "deterministic_clauses": [],
      "nondeterministic_reason_codes": [
        "contextual_judgment",
        "undefined_scope"
      ],
      "review_status": "primary_agent_reviewed"
    },
    {
      "control_id": "PRC-23-008",
      "revision": 1,
      "semantic_sha256": "ac42dad6319e5a5737d49d11e0f350d0c208dc090b0a48b44beacf49b2fec364",
      "classification": "nondeterministic",
      "route": "unbounded_claim",
      "reason": "Preventing all lost updates and write races is a universal behavioral claim over concurrent schedules; bounded tests or static patterns cannot prove it for arbitrary project logic.",
      "deterministic_clauses": [],
      "nondeterministic_reason_codes": [
        "unbounded_scope"
      ],
      "review_status": "primary_agent_reviewed"
    },
    {
      "control_id": "PRC-23-009",
      "revision": 1,
      "semantic_sha256": "d0b99ea99d6325f01a7039df4faa50bbca5e8800fcf2e2dbfbf874cc1f646e72",
      "classification": "nondeterministic",
      "route": "contextual_judgment",
      "reason": "Duplicate handling can be observed for named cases, but the word safely depends on domain side effects, compensation rules, and acceptable outcomes for each message.",
      "deterministic_clauses": [],
      "nondeterministic_reason_codes": [
        "contextual_judgment",
        "undefined_scope"
      ],
      "review_status": "primary_agent_reviewed"
    },
    {
      "control_id": "PRC-23-010",
      "revision": 1,
      "semantic_sha256": "00ef6e6823973e8d64de33727a50a40fe7d29cfbfcb152f138f0024a4777e593",
      "classification": "nondeterministic",
      "route": "accountable_human_decision",
      "reason": "Whether delivery semantics are understood is a human knowledge and review claim, not a machine-observable property of queue configuration or documentation alone.",
      "deterministic_clauses": [],
      "nondeterministic_reason_codes": [
        "human_accountability"
      ],
      "review_status": "primary_agent_reviewed"
    },
    {
      "control_id": "PRC-23-011",
      "revision": 1,
      "semantic_sha256": "6ddd2713bc4bbc388edfafe2129df6f46d9f59be4cf10b0d9e204232a37188bd",
      "classification": "nondeterministic",
      "route": "mixed",
      "reason": "A bounded redelivery test can verify declared idempotency cases, but completeness of the redeliverable-consumer set and idempotence across all payloads and side effects cannot be guaranteed generically.",
      "deterministic_clauses": [
        {
          "statement": "Each consumer declared redeliverable has a versioned duplicate-delivery test whose recorded expected effects equal the single-delivery effects.",
          "checker_family": "execution_evidence",
          "evidence_authority": "executed"
        }
      ],
      "nondeterministic_reason_codes": [
        "undefined_scope",
        "unbounded_scope",
        "mixed_with_nondeterministic_child"
      ],
      "review_status": "primary_agent_reviewed"
    },
    {
      "control_id": "PRC-23-012",
      "revision": 1,
      "semantic_sha256": "9ce78d7a4d2715dc930dd9d919864d1b650e93812f253858e6bb4d64d76dc80c",
      "classification": "nondeterministic",
      "route": "mixed",